QA_ID,법률분류,질문,답변,출처유형
QA_0183,개인회생>개인회생절차의인가및변제>인가결정및효력>Ⅱ.인가결정의효력,개인회생절차와 관련하여 인가결정이후에 발생한 새로운 채무를    채권자목록에 추가할수 있나요?,인가결정후에 발생한 채무는 채권자목록에 추가할 수는 없습니다.  새로 발생된 채무를 개인회생채권으로 포함시키려면 현재 인가결정이 난 사건을 취하하고 추가로 발생한 채무를 포함시킨 채권자목록을 작성하여 다시 개인채무자회생을 신청해야 합니다.,기본질문답변
QA_0184,개인회생>개인회생절차의인가및변제>인가결정및효력>Ⅱ.인가결정의효력,"급여에 채권압류 및 전부명령이 되었는데, 개인회생을 신청하면 어떻게 처리되나요?","개인회생신청 후 변제계획인가결정이 있게되면 회생채무자는 그 이후의 급여를 전부 수령할 수 있고, 전부채권자는 개인회생절차를 통해서 변제를 받게 됩니다.",기본질문답변
QA_0185,개인회생>개인회생절차의인가및변제>인가결정및효력>Ⅱ.인가결정의효력,변제계획 인가의 효력은 어떤가요?,○ 변제계획 인가결정은 권리변경의 효력이 없기 때문에 변제계획이 인가되었다고 하더라도 채권자의 권리 자체에 영향을 미치지는 않습니다. ○ 변제계획 인가결정이 있으면 개인회생재단에 속하는 모든 재산은 원칙적으로 채무자에게 다시 귀속됩니다. 따라서 채무자는 변제계획 인가 후에 재산에 대한 소유권을 자유로이 행사할 수 있게 됩니다. 다만 변제계획 또는 변제계획 인가결정에서 이와 다르게 정할 수 있습니다. ○ 변제계획 인가결정이 있는 때에는 개시결정으로 인하여 중지된 파산절차와 개인회생채권에 기한 강제집행?가압류 또는 가처분은 그 효력을 잃게 됩니다. 다만 변제계획 또는 변제계획 인가결정에서 이와 다르게 정한 때에는 그렇지 않습니다.,기본질문답변
QA_0186,개인회생>개인회생절차의인가및변제>인가결정및효력>Ⅱ.인가결정의효력,변제계획인가결정으로 인한  개인회생채권에 기한 강제집행 ？ 가압류 또는 가처분의 효력 상실,변제계획인가결정이 있는 때에는 채무자 회생 및 파산에 관한 법률 제600조의 규정에 의하여 중지된 회생절차 및 파산절차와 개인회생채권에 기한 강제집행 ? 가압류 또는 가처분은 그 효력을 잃습니다. 다만 변제계획 또는 변제계획인가결정에서 다르게 정한 때에는 그러하지 않습니다.,기본질문답변
QA_0187,개인회생>개인회생절차의인가및변제>인가결정및효력>Ⅱ.인가결정의효력,"저는 급여소득자로 생활하고 있는데 채무가 많아서 개인회생을 신청하고자 합니다. 그런데 현재 본인의 급여에 채권가압류가 들어와 있어 급여 중 압류되지 않은 부분으로 생활하고 있으며 회사는 매월 급여 중 일정액을 적립하고 있습니다. 이러한 상황에서 개인회생을 신청할 경우 급여 압류를 해제할 수 있다고 들었는데 저는 언제, 어떻게 급여 압류를 해제할 수 있습니까?","채무자는 회생신청후 개시결정, 인가결정단계를 거친후 변제계획인가결정 정본과 개인회생채권자목록을 첨부하여 채권가압류명령을 발한 법원에 채권 가압류집행 해제신청을 해야합니다. 이 경우에 해당 집행법원은 가압류가 실효되었다는 취지를 제3채무자에게 통지하게 되고, 이 후 채무자는 가압류 적립금과 향후 급여 전액을 수령할 수 있을 것입니다.",기본질문답변
QA_0188,개인회생>개인회생절차의인가및변제>인가결정및효력>Ⅱ.인가결정의효력,"저는 조그마한 중소기업체 과장으로 근무하면서 급여소득자로 생활하고 있는데 채무가 많아서 개인회생을 신청하고자 합니다. 그런데 현재 본인의 급여에 채권가압류, 채권압류 및 추심명령이 들어와 있어 급여 중 압류되지 않은 부분으로 생활하고 있으며 회사는 매월 급여 중 일정액을 적립하여 1년마다 한번씩 법원에 공탁하고 있습니다. 이러한 상황에서 개인회생을 신청할 경우 급여 압류를 해제할 수 있다고 들었는데 저는 언제, 어떻게 급여 압류를 해제할 수 있고, 회사가 보유하고 있는 적립금과 회사가 공탁하여 법원에서 아직 배당하지 않은 공탁금은 어떻게 처리되는지요?","「채무자 회생 및 파산에 관한 법률?은 개인회생채권자의 강제집행에 따른 변제의 불공평을 방지하고 채무자가 안정적으로 변제계획을 마련하여 이를 수행하는 것을 보장하기 위해 ①개인회생절차 개시신청 단계에서부터 채무자의 재산에 대한 강제집행·가압류 또는 가처분의 중지 또는 금지를 신청할 수 있도록 하고(같은 법 제593조 제1항), ②개인회생절차 개시결정이 있는 경우 위와 같은 강제집행 등이 당연히 중지 또는 금지되도록 하며(같은 법 제600조 제1항), ③변제계획 인가결정이 있으면 중지된 강제집행 등이 실효됨을 규정하고 있습니다(같은 법 제615조 제3항). 따라서 채무자의 급여채권에 압류 및 추심명령 등 강제집행이 있는 경우 채무자가 법원에 중지명령을 신청하면 법원은 필요하다고 인정하는 때 중지명령 결정을 할 수 있고, 동 결정 정본을 강제집행을 개시한 개인회생채권자에게 송달하여 강제집행을 중지하도록 하고 있습니다. 그러나 급여채권에 대한 압류 및 추심명령에 대한 중지명령은 개인회생채권자의 추심명령에 기한 추심권 행사를 중지시키고 이를 배당받아 집행을 종료시키는 것으로 저지할 뿐이며 압류된 급여를 채무자에게 지급하는 등 압류의 효력까지 소멸시키지는 않습니다. 따라서 급여채권 강제집행의 제3채무자인 사용자(회사)가 압류채권자를 위해 배당 또는 공탁을 위해 보관하고 있는 적립금이 중지명령에 의하여 더욱 늘어갈 뿐입니다.위 사안과 같이 급여채권에 대한 강제집행이 있는 경우 개인회생제도에서는 ①사용자가 보관하고 있는 적립금을 어떻게 처리해야 하는지, ②급여에 대한 압류 집행을 어떻게 해제하고 적립금 또는 공탁금(법원에 공탁되어 배당되지 않았을 경우)을 어떻게 찾아야 하는지, ③최초의 변제개시일을 언제로 정해야 하는지가 문제됩니다.첫째, 압류 적립금 처리 방법과 관련하여, 사용자가 압류채권자를 위해 공탁하고자 보관하고 있는 압류 적립금은 변제계획 인가결정에 의하여 압류의 효력이 소멸하면 원칙적으로 사용자는 이를 채무자에게 전부 지급해야 하고 따라서 압류 적립금액을 확인하여 채무자는 재산목록에 이를 기재해야 합니다. 그러나 압류 적립금은 압류 기간과 사용자의 배당 또는 공탁의 주기에 따라 경우에 따라서는 상당한 금원에 이르는 경우가 많은 관계로 이를 채무자가 변제계획 인가결정으로 모두 수령할 수 있도록 허용할 경우 처음부터 압류 적립금을 수령할 목적으로 개인회생을 신청하는 것을 배제할 수 없게 됩니다.이러한 경우 법원은 실무상 압류 적립금을 제1회 변제기일에 일시에 투입하는 것으로 하되, 그 투입액만큼 월변제예정액을 감액하는 방식(즉, 당초 일시 투입을 전제로 하지 않았을 경우의 가용소득에 따른 총변제예정액에서 일시투입 압류 적립금을 공제한 액수를 변제개월수-1로 나눈 금액이 월변제예정액이 됨)으로 변제계획안을 작성할 것을 요청하고 있으며, 만일 채무자가 이에 불응할 경우 개인회생절차 개시신청이 채권자 일반의 이익에 적합하지 아니한 때, 그 밖에 신청이 성실하지 아니하거나 상당한 이유 없이 절차를 지연시키는 때에 해당하여 기각될 수 있습니다(같은 법 제595조 제6, 7호). 다만, 개인회생절차 개시신청 당시 신청서에 기재한 압류 적립금과 변제계획 인가결정 당시 실제로 적립된 금액은 개인회생절차가 수 개월 소요되는 점에 비추어 금액의 차이가 있을 수 있는데, 채무자는 당초 인가받은 변제계획안상 압류 적립금액을 제1회 변제기일이 일시투입하면 되고 일시투입하지 않은 압류 적립금의 차액은 그 금액이 상당하지 않는 이상 이를 보유하여도 무방할 것으로 보입니다.둘째, 압류를 해제하여 적립금 또는 공탁금을 수령하는 방법과 관련하여, 원칙적으로 변제계획 인가결정이 선고된 경우 동 결정의 효력으로 채무자의 급여채권에 대한 압류 및 추심명령 등 강제집행은 당연히 실효되므로(같은 법 제615조 제3항), 채무자는 별도의 조치 없이도, 사용자가 보관하고 있는 압류 적립금이나 사용자가 압류 채권자들에 대한 배당을 위해 공탁하여 아직 배당되지 않은 공탁금을 수령할 수 있다고 볼 수 있습니다. 그러나 사용자 입장에서는 일반적으로 압류가 해제된 근거를 제출하기 전까지는 압류 적립금을 채무자에게 지급하지 않을 것이며 이러한 압류집행의 외관을 제거하기 위해 채무자는 변제계획인가결정 정본(보통 채무자에게 송달하지 않으므로 법원에 정본 발급을 신청해야 함)과 개인회생채권자목록을 첨부하여 채권압류명령을 발한 법원에 채권 압류집행 해제신청을 할 수 있고, 해당 집행법원은 가압류 또는 압류가 실효되었다는 취지를 제3채무자에게 통지(민사집행규칙 제160조)함으로써 사용자로부터 압류 적립금을 일시에 지급받을 수 있습니다.그런데 급여압류로 인하여 사용자가 압류 채권자들에 대한 배당을 위해 공탁하여 아직 배당되지 않은 공탁금 또는 배당하였으나 채권자가 출급하지 않고 남아 있는 공탁금을 채무자에게 지급하는 방법은 아직 법원에서도 명확히 정리되지 않은 것으로 보입니다.일반적으로 공탁금에 대한 배당을 실시하는 경우 배당받을 가압류 채권자가 본안소송에서 패소하는 등 채권자에 대하여 배당을 실시할 수 없게 되는 사정이 발생한 경우 법원은 배당표를 변경하여야 하고 이를 위하여 추가배당기일을 열어 해당 채권자를 제외하고 배당을 실시하고 있는데(민사집행법 제161조 제2항 제1호, 제160조, 제256조), 대체적인 실무례는 위와 같은 절차를 준용하여, 변제계획 인가결정으로 강제집행 등이 실효된 경우 집행법원은 추가배당기일을 지정하여 채무자에게 공탁금을 모두 배당하는 방식으로 공탁금을 지급하는 방식을 취하고 있습니다. 그러나 이와 같은 방법은 배당절차의 지연으로 수개월의 기간이 소요될 수 있어 공탁금을 제1회 변제기일에 일시에 투입하는 것으로 변제계획을 인가받은 채무자로서는 변제계획을 수행하지 못하는 경우가 발생할 수 있는 문제점이 있을 수 있습니다.셋째, 최초의 변제개시일과 관련하여, 최초의 변제는 변제계획인가일로부터 1월 이내에 개시하면 족하지만(채무자 회생 및 파산에 관한 법률 제611조 제4항), 변제계획안의 수행가능성을 소명하기 위하여 변제계획안 제출일로부터 60일 후 90일 이내에 일정한 날을 제1회로 하여 매월 일정한 날에 그 변제계획안상의 매월 변제액을 회생위원에게 임치할 뜻을 기재할 수 있고(개인회생사건 처리지침 제7조 제3항), 실무에서는 거의 대부분 동 지침과 같은 내용으로 변제계획안을 작성하여 변제계획인가결정 이전부터 최초의 변제를 개시하고 있는 실정입니다.그러나 급여채권에 압류 등 강제집행이 개시된 경우에는 변제계획 인가결정이 선고되기 전까지 압류의 효력이 여전히 유지되어 위 지침과 같이 변제계획 인가결정 이전부터 변제계획안을 수행하는 것은 사실상 불가능한 것으로 평가되므로 이러한 경우는 최초의 변제개시시일을 ‘변제계획 인가결정 이후 최초로 도래하는 변제일’로 하여 변제계획안을 작성하여 그와 같이 변제계획을 수행할 수 있습니다.귀하의 경우, 변제계획 인가결정을 선고받으면 그 결정 정본 및 개인회생채권자목록을 첨부하여 급여채권을 압류한 집행법원에 채권압류 집행해제를 신청하여 회사로부터 압류 적립금과 향후 급여 전액을 수령할 수 있을 것으로 보이며, 법원 공탁금도 위 서류를 집행법원(최초 압류 집행을 한 법원, 민사집행법 제161조)에 제출하여 추가배당기일에서 배당을 받을 수 있을 것으로 보입니다.따라서 귀하는 수령한 적립금 및 공탁금을 최초 변제개시일에 일시 투입하고 향후 급여 전액을 수령하여 인가된 변제계획안에 따른 변제계획을 수행하시면 될 것으로 보입니다.",기본질문답변
QA_0189,개인회생>개인회생절차폐지>개인회생절차폐지및효력>Ⅰ.개인회생절차폐지,개인파산/회생에서 채무자가 도중에 변제계획을 지키지 않으면 어떻게 되나요?,"○ 변제계획 수행 도중에 채무자의 실직, 급여의 감소, 생계비의 증가 등으로 인하여 채무자가 변제계획을 지키지 못하는 경우가 생길 수 있습니다. 채무자가 인가된 변제계획을 이행하지 않는 경우에 법원은 이해관계인의 신청에 의하거나 직권으로 개인회생절차폐지결정을 하게 됩니다.○ 따라서 채무자는 기존의 변제계획에 대하여 사정변경에 의한변제계획 변경안을 법원에 제출하여 법원으로부터 인가를 받게 되면 개인회생절차폐지결정을 면할 수 있습니다.○ 또한 채무자는 다음의 3가지 요건을 모두 갖춘 경우에 한하여 당초의 변제 계획을 지키지 못하였더라도 법원으로부터 면책결정을 받을 수 있습니다.   첫째, 채무자가 책임질 수 없는 사유로 인하여 변제를 완료하지 못하였어야 합니다.   둘째, 개인회생채권자가 면책결정일까지 변제받은 금액이 채무자가 파산절차를 신청한 경우 파산절차에서 배당받을 금액보다 적지 않아야 합니다.   셋째, 변제계획의 변경이 불가능한 경우여야 합니다.",기본질문답변
QA_0190,개인회생>개인회생절차폐지>개인회생절차폐지및효력>Ⅰ.개인회생절차폐지,개인회생인가결정이 폐지된 날(정확히는 폐지가 확정된 날)로부터 개인회생채권의 소멸시효가 새로이 진행하는데 소멸시효 기간은 어떻게 되나요?,"채무자회생및파산에관한법률 제32조 3호, 제589조 제2항은 “개인회생채권자목록의 제출에 대하여 소멸시효중단의 효력이 있다.”고 규정하고 있는데, 그에 따른 시효중단의 효력은 특별한 사정이 없는 한 개인회생절차가 진행되는 동안에는 그대로 유지되고, 개인회생폐지결정이 확정된 때로부터 새로이 진행됩니다.(대법원 2013. 9. 12. 선고 2013다42878 판결)그리고 위 법률 제603조에 의하면 개인회생채권자목록에 기재된 채권자가 제596조 제2항 제1호의 규정에 의한 이의 기간 안에 개인회생채권조사확정 재판을 신청하지 아니한 경우에는 개인회생채권자목록의 기재대로 채권이 확정되고, 법원이 확정된 개인회생채권을 개인회생채권자표에 기재한 경우 그 기재는 확정판결과 동일한 효력이 있으며, 개인회생절차폐지결정이 확정된 때에는 개인회생채권자는 채무자에 대하여 개인회생채권자표에 기하여 강제집행을 할 수 있다고 규정하고 있습니다.한편 민법 제165조 제1항은 “판결에 의하여 확정된 채권은 단기의 소멸시효에 해당한 것이라도 그 소멸시효는 10년으로 한다.” 제2항은 “파산절차에 의하여 확정된 채권 및 재판상의 화해, 조정 기타 판결과 동일한 효력이 있는 것에 의하여 확정된 채권도 전항과 같다.”라고 규정하고 있습니다.위 규정들에 의하면 개인회생이 폐지된 경우 그 개인회생채권은 개인회생폐지결정이 확정된 다음 날부터 다시 10년간 소멸시효기간이 진행될 것으로 보입니다.",기본질문답변
QA_0191,개인회생>개인회생절차폐지>개인회생절차폐지및효력>Ⅰ.개인회생절차폐지,개인회생절차 폐지의 효과,"<p>개인회생절차 폐지결정의 확정으로 개인회생절차는 종료됩니다. 따라서 변제계획인가 전 폐지된 경우, 중지?금지 명령이나 개인회생절차개시결정에 의하여 발생한 강제집행 등의 중지?금지의 효력은 소멸하며 개인회생채권자들은 자유로이 채권을 행사할 수 있습니다. 또한 금융기관은 변제계획인가결정에 따라 해제된 연체정보 등을 다시 등록합니다(일반신용정보관리규약 제16조 제3항). <span style=""mso-fareast-font-family:휴먼명조;letter-spacing:-0.1pt;font-size:11.0pt;""> </span></p>",기본질문답변
QA_0192,개인회생>개인회생절차폐지>개인회생절차폐지및효력>Ⅰ.개인회생절차폐지,변제계획인가 전 개인회생절차가 폐지될 수 있는 경우,"법원은 다음의 사유가 있는 경우 변제계획인가가 있기 전에 개인회생절차를 폐지하게 됩니다.            1.개인회생절차의 개시결정 당시 신청권자의 자격을 갖추지 아니한 때2.채무자가 신청일 전 5년 이내에 면책(파산절차에 의한 면책 포함)을 받은 사실이 있는 때3.채무자가 제출한 변제계획안을 인가할 수 없을 때4.채무자가 개인회생절차개시신청시 첨부하여야 할 서류의 어느 하나에 해당하는 서류를 제출하지 아니하거나, 허위로 작성하여 제출하거나 또는 법원이 정한 제출기한을 준수하지 아니한 때5.채무자가 정당한 사유 없이 채권자집회기일에 출석 또는 설명을 하지 아니하거나 허위의 설명을 한 때",기본질문답변
QA_0193,개인회생>개인회생절차폐지>개인회생절차폐지및효력>Ⅰ.개인회생절차폐지,변제계획인가 후 개인회생절차가 폐지된 경우 변제계획인가결정의 효력으로 실효된 강제집행 등의 효력,"개인회생절차가 변제계획인가 후 폐지된 경우에 변제계획인가결정의 효력으로 실효된 강제집행 등의 효력이 부활되는지 문제가 되는데, 이에 대하여 법은 이미 행한 변제와 개인회생절차의 규정에 의하여 생긴 효력에 영향을 미치지 아니한다고 규정하고 있습니다. 따라서 폐지 전 개인회생채권자들에 대한 변제는 채무소멸의 효력이 있으며, 실효된 강제집행 등의 효력은 다시 부활하지 않습니다.",기본질문답변
QA_0194,개인회생>개인회생절차폐지>개인회생절차폐지및효력>Ⅰ.개인회생절차폐지,변제계획인가 후 개인회생절차가 폐지될 수 있는지,"법원은 변제계획인가 이후에도 다음의 사유가 있는 경우 개인회생절차폐지의 결정을 하여야 합니다.                     1.면책불허가결정이 확정된 때2.채무자가 인가된 변제획을 이행할 수 없음이 명백한 때(다만, 채무자가 재량면책신청에 의한 면책결정을 받은 때를 제외함)3.채무자가 재산 및 소득의 은닉 그 밖의 부정한 방법으로 인가된 변제계획을 수행하지 아니하는 때",기본질문답변
QA_0195,개인회생>개인회생절차폐지>개인회생절차폐지및효력>Ⅰ.개인회생절차폐지,저희 남편이 선배에게 1500만원정도 돈을 빌려줬읍니다. 하지만 시간이 지나도 갚지 않아 공증을 받았는데 그 선배라는 사람이 개인회생신청을 해서 법원에서 30%정도 갚는 것으로 결정이 났는데 그 사람이 돈을 주지 않고 있습니다. 이런 경우 어떻게 해야 하나요 전액 다 받지 못하는 것도 속상한데 개인회생결정 난것도 주지 않아 너무 화가나고 속상해요 이럴때는 법적으로 어떻게 조취를 취해야할까요?,"채무자가 개인회생절차를 신청하여 변제계획안이 인가되었으나 채무자가 변제계획안에 따른 변제를 하지 않고 있는 상황으로 보입니다. 이런 경우 개인회생채권자는 개인회생폐지신청을 할 수 있습니다. 개인회생폐지신청이 인정되어 개인회생절차가 폐지되면 채무자의 재산에 대해 강제집행을 할 수 있습니다. 단, 채무자의 재산이 월급 밖에 없는 상황이라면 월급에 대해서 강제집행을 하더라도 다른 채권자들도 강제집행절차에 참여할 것이고 각 채권액에 비례하여 배당받게 되어 배당되는 금액이 적을 수도 있으니 참고하시기 바랍니다.",기본질문답변
QA_0196,개인회생>개인회생절차폐지>개인회생절차폐지및효력>Ⅰ.개인회생절차폐지,채무자가 도중에 변제계획을 지키지 않으면 어떻게 되나요?,"○ 변제계획 수행 도중에 채무자의 실직, 급여의 감소, 생계비의 증가 등으로 인하여 채무자가 변제계획을 지키지 못하는 경우가 생길 수 있습니다. 채무자가 인가된 변제계획을 이행하지 않는 경우에 법원은 이해관계인의 신청에 의하거나 직권으로 개인회생절차폐지결정을 하게 됩니다. ○ 그러나 채무자는 기존의 변제계획을 자신에게 유리하게 변경하는 내용의 변제계획 변경안을 법원에 제출하여 법원으로부터 인가를 받게 되면 개인회생절차폐지결정을 면할 수 있습니다. ○ 또한 채무자는 다음의 3가지 요건을 모두 갖춘 경우에는 당초의 변제  계획을 지키지 못하였더라도 법원으로부터 면책결정을 받을 수 있습니다.     첫째, 채무자가 책임질 수 없는 사유로 인하여 변제를 완료하지 못하였어야 합니다.     둘째, 개인회생채권자가 면책결정일까지 변제받은 금액이 채무자가 파산절차를 신청한 경우 파산절차에서 배당받을 금액보다 적지 않아야 합니다.     셋째, 변제계획의 변경이 불가능한 경우여야 합니다.",기본질문답변
QA_0197,개인회생>개인회생절차폐지>개인회생절차폐지및효력>Ⅰ.개인회생절차폐지,채무자가 돈을 갚지 않아 공증을 받아 놓았습니다. 하지만 강제집행을 하기 전에 채무자가 법원에 개인회생신청을 하여 30%정도 지급하라는 인가결정을 받았습니다. 채무자는 인가결정후에도 돈을 지급하지 않고 있습니다. 일정한 월급을 받고 있는 채무자에 대하여 조치할 수 있는 방법은 어떠한 것이 있을까요?,"채무자가 개인회생절차를 신청하여 변제계획안이 인가되었으나 채무자가 변제계획안에 따른 변제를 하지 않고 있는 상황으로 보입니다. 하지만 이러한 경우에 먼저 법원 개인회생부서에 전화연락을 하셔서 본인의 채권계좌번호신고가 정상적으로 처리되어 있는지를 확인하시고, 채무자가 변제금을 입금하지 않는 경우라면 법원에 개인회생절차 폐지신청을 하실수 있을 것으로 보입니다.폐지결정이 확정되면 개인회생절차는 종료되며, 개인회생채권자는 개인회생절차의 제약에서 벗어나 변제계획과 상관없이 채권을 추심하고 강제집행을 할 수 있습니다.",기본질문답변
QA_0198,개인회생>개인회생절차폐지>폐지결정에대한불복방법>Ⅰ.개인회생절차폐지결정에대한불복방법,개인회생절차 폐지에 대한 불복,"개인회생절차폐지결정에 대하여는 즉시항고를 할 수 있습니다. 즉시항고기간은 공고 후 14일 이내이며, 즉시항고장이 제출된 경우 법원은 기간을 정하여 항고인에게 보증으로 대법원규칙이 정하는 범위 안에서 금전 또는 법원이 인정하는 유가증권을 공탁하게 할 수 있고, 항고인이 그 기간 안에 보증을 제공하지 아니하는 때에는 법원은 결정으로 항고를 각하하게 됩니다.",기본질문답변
