QA_ID,법률분류,질문,답변,출처유형
QA_0285,개인회생>개시결정및채권자이의등>개시(기각)결정및효력>Ⅱ.개시기각결정,"저는 4년 전에 개인회생개시신청을 하여 변제계획을 인가받았으나 그 후 압류 적립된 급여의 일부를 회생재단에 편입하지 않고 임의 소비한 사실이 발견되어 개인회생절차가 폐지되었고, 그 후 3회에 걸쳐 개인회생절차 개시신청을 하였으나 개인회생절차를 남용하여 채권자의 권리행사를 방해하였다는 점을 이유로 하여 그 신청이 기각되었으며, 이에 다시 개인회생절차개시신청을 하자 별다른 심리 없이 그 신청 자체로 ‘신청이 성실하지 아니한 때’에 해당한다고 하여 기각 결정을 받았습니다. 이러한 경우 과거에 개인회생절차개시신청을 하였다가 폐지나 기각되었음에도 다시 개인회생절차개시신청을 하였다는 사실만으로 신청이 성실하지 않다고 보아 기각하는 것이 타당한가요?","채무자 회생 및 파산에 관한 법률 제595조 각 호는 개인회생절차개시신청 기각사유에 관하여 규정하고 있습니다. 이 중 동조 제7호는 ‘그 밖에 신청이 성실하지 아니하거나 상당한 이유 없이 절차를 지연시키는 때’를 신청 기각사유로 정하여 동조 제1호 내지 제6호의 사유에 해당하지 않더라도 개인회생절차개시신청이 성실하지 아니하거나, 상당한 이유 없이 절차를 지연시키는 때에는 개인회생절차개시신청을 기각할 수 있는 것으로 보고 있습니다.법원에서 동법 제595조 제7호에서 정한 ‘그 밖에 신청이 성실하지 아니한 때’에 해당한다는 이유로 채무자의 개인회생절차개시신청을 기각하려면 채무자에게 동법 제595조 제1호 내지 제5호에 준하는 절차적인 과실이 있거나, 채무자가 개인회생절차의 진행에 따른 효과만을 목적으로 하는 등 부당한 목적으로 개인회생절차개시신청을 하였다는 사정이 인정되어야 합니다. 채무자 회생 및 파산에 관한 법률은 파산신청의 기각사유로 동법 제309조 제1항 제5호가 ‘그 밖에 신청이 성실하지 아니한 때’를 포괄적인 파산신청의 기각사유로 규정하고, 이와 별개로 동법 제309조 제2항에서 ‘파산절차의 남용’을 기각사유로 정하고 있는 것과는 달리, ‘개인회생절차의 남용’을 개인회생절차개시신청의 기각사유로 따로 규정하고 있지는 않으나 동법 제696조 제7호의 신청불성실에는 '개인회생절차의 남용‘도 포함되는 개념으로 해석함이 상당합니다. 이와 관련하여 판례는 “채무자가 세 번에 걸쳐 개인회생절차 개시신청을 하였으나 개인회생절차를 남용하여 채권자의 권리행사를 방해하였다는 등의 사유로 신청이 기각되었는데, 이후 특별한 사정변경이 없음에도 또다시 개인회생절차 개시신청을 한 것 자체로 ‘신청이 성실하지 아니한 때’에 해당된다는 이유로 개인회생절차 개시신청을 기각한 사안에서, 통상 개인회생채무자는 개인회생절차 개시신청 기각결정에 대한 항고로 다투기보다는 재신청을 택하는 경우가 많고 법에 의하여 재신청이 명시적으로 금지되어 있지 않은 점, 법은 도산절차에 있어서 채권자의 이익과 채무자의 실질적 갱생을 위하여 청산형의 파산절차보다는 갱생형의 개인회생절차를 우선에 두고 있는 점, 이 사건 기각결정이 확정된다면 사실상 재항고인은 회생의 길이 봉쇄된다는 점, 이 사건 신청은 최초의 개인회생절차 폐지시로부터는 3년 이상이 경과된 후에 이루어졌고 다른 남용 사유가 보이지 않는다면 사정변경이 있다고 볼 여지도 있는 점을  고려하면 위 개인회생절차 개시신청이 성실하지 아니한 경우에 해당한다고 단정하기 어려움에도, 채무자가 부당한 목적으로 개인회생제도를 이용하였다는 등 신청 불성실 사유가 있는지에 대하여 심리를 하지 않은 채 채무자의 과거 경력만을 문제 삼아 위 개인회생절차 개시신청을 기각한 것은 위법하다”고 한바 있습니다(대법원 2011. 6. 10. 자 2011마201 결정 참조). 또한 채무자가 부당한 목적으로 개인회생절차개시신청을 하였는지는 그 신청에 이르게 된 경위, 채무의 규모, 발생 시기 및 사용 내역, 강제집행 대상 재산의 유무, 변제계획안의 내용 등 제반사정을 종합하여 판단하여야 합니다(대법원 2012. 1. 31. 자 2011마2392 결정 참조).위에서 언급한 내용을 종합해볼 때, 귀하의 경우 개인회생절차가 폐지된 후 세 차례에 걸쳐 추가로 개인회생절차개시신청을 하고 또다시 개인회생신청을 하였는바, 법원이 개인회생절차 개시신청을 하였다가 기각당한 경력을 근거로 귀하의 신청이 성실하지 아니한 경우에 해당하는 것으로 판단하려면, 이전의 개인회생절차개시신청이 기각된 경위가 무엇인지, 그 후 채무자의 재산상황이나 채권자들의 채권회수 정도 등의 사정을 심리하여 귀하가 부당한 목적으로 개인회생제도를 이용하였다는 등 신청 불성실의 사유가 있는지 여부를 판단하였어야 함에도 불구하고 이러한 점들을 충분히 심사하지 아니한 채 과거에 반복된 개인회생절차개시신청 경력만을 이유로 개인회생절차개시신청을 기각하는 것은 부당한 것으로 볼 수 있습니다. 만일 이러한 법원의 개인회생절차신청 기각 결정이 위법함을 이유로 이에 대해 다투고자 하실 경우에는 즉시항고를 제기해볼 수 있을 것이며(채무자 회생 및 파산에 관한 법률 제598조 제1항), 이때 판례는 “개인회생절차의 요건을 충족하고 있는지 여부는 개시신청 당시를 기준으로 하여 판단하는 것이 원칙이나, 개시신청에 관한 재판에 대하여 즉시항고가 제기된 경우에는 항고심의 속심적 성격에 비추어 항고심 결정 시를 기준으로 판단한다.”고 하고 있으므로(대법원 2011. 6. 10. 자 2011마201 결정 참조), 항고심에서 귀하의 개인회생절차개시신청이 적법한 것인지 여부는 항고심 결정시를 기준으로 판단될 것입니다.",사례질문답변
QA_0286,개인회생>개시결정및채권자이의등>개시(기각)결정및효력>Ⅱ.개시기각결정,저는 얼마 전 법원에 개인회생개시신청을 하였습니다. 그런데 개인회생개시신청서를 제출하기 전에 채무초과상태에서 저의 채권자인 숙부에게 그 채무의 변제에 갈음하고자 2천만원의 임차보증금반환채권을 양도한 적이 있습니다.  혹여나 이런 사정 때문에 개인회생개시신청이 기각되지는 않을까요?,"채무자 회생 및 파산에 관한 법률 제595조 제6호는 ‘개인회생절차에 의함이 채권자 일반의 이익에 적합하지 아니한 때’에는 개인회생절차개시신청을 기각할 수 있다고 정하고 있습니다.‘개인회생절차에 의함이 채권자 일반의 이익에 적합하지 아니한 때’란 개인회생절차에 의하여 변제되는 채무액의 현재가치가 채무자 재산의 청산가치에 미치지 못하는 등과 같이 변제기, 변제율, 이행의 확보 등에서 개인회생절차에 의하는 것이 전체 채권자의 일반의 이익에 적합하지 아니한 것을 의미합니다(대법원 2011. 9. 21.자 2011마1530 결정 등 참조). 즉, 채권자의 이익은 변제기, 변제율, 이행의 확보 등을 종합적으로 고려해야 하고, 채권자의 일반의 이익은 특정의 채권자가 아니고 채권자 전체에게 이익이 되는 것을 의미합니다.실제로 실무상 채무자가 개인회생절차개시신청 전에 특정 채권자에 대한 편파적인 변제나 담보제공 행위를 하여 다른 채권자들을 해하는 결과를 초래하였고, 채무자의 가용소득이나 보유하는 재산의 처분만으로는 부인권 행사로 증가될 청산가치만큼을 변제하지 못하는 변제계획안을 제출하는 경우가 많이 있습니다. 이 경우 채무자 회생 및 파산에 관한 법률 제595조 제6호에서 정한 기각사유로 볼 수 있는지 문제됩니다.과거 하급심에서는 이와 같은 경우 채무자가 제출한 변제계획안이 청산가치를 보장하지 않는다고 보고 채무자 회생 및 파산에 관한 법률 제595조 제6호의 사유로 개인회생절차개시신청을 기각한 사례가 많이 있었습니다. 이에 대해 대법원은 “개인회생절차는 급여소득자 또는 영업소득자가 5년을 넘지 않는 기간 동안 그 수입 중에서 생계에 필요하다고 인정되는 비용을 제외한 나머지 금액을 변제에 투입하여 그 총변제액이 채무자가 파산하는 때에 배당받을 총액보다 적지 아니한 경우에 이용할 수 있는 제도로서(채무자 회생 및 파산에 관한 법률 제579조, 제614조 제1항 제4호), 개인회생절차가 개시되면 채무자에 대한 파산절차 등은 중지·금지되고(채무자 회생 및 파산에 관한 법률 제600조 제1항), 채무자가 장래 얻게 될 소득이 채권자에 대한 변제재원이 되며, 만약 채무자가 보유한 재산의 청산가치가 위와 같은 방법에 의한 총변제액의 현재가치보다 많을 경우에는 재산의 일부를 변제계획에 투입해야 하는 점 등에서 파산절차와 구별되는 것이다. 개인회생절차에서의 부인권은 채무자가 개인회생절차 개시 전에 자신의 일반재산에 관하여 채권자들을 해하는 행위를 한 경우 그 효력을 부인하여 일탈된 재산을 개인회생재단으로 회복시키기 위한 제도로서, 부인권의 행사는 개인회생재단에 속하는 채무자의 재산을 원상으로 회복시키므로(채무자 회생 및 파산에 관한 법률 제584조 제1항, 제397조 제1항), 부인권 행사요건이 인정될 경우 법원은 채권자 또는 회생위원의 신청에 의하거나 직권으로 채무자에게 부인권 행사를 명할 수 있을 뿐 아니라(채무자 회생 및 파산에 관한 법률 제584조 제3항) 변제계획안 수정명령(채무자 회생 및 파산에 관한 법률 제610조 제3항)을 통하여 부인권 행사로 원상회복될 재산 또는 이를 포함한 총재산의 청산가치 이상을 변제에 투입하도록 할 수도 있다. 이 때 채무자가 수정명령 등에 불응하면 변제계획이 불인가되거나 개인회생절차가 폐지될 수 있고, 부인권 행사의 상대방이 그 받은 이익 등을 반환하여 채권이 부활하게 되면 변제계획 인가 이후에도 변제가 완료되기 전까지는 이를 반영한 변제계획변경안이 제출될 수 있다. 이와 같이 개인회생절차는 파산절차가 예정하고 있는 청산가치의 배분 이상의 변제가 이루어질 것을 전제로 하고 있는 제도라는 점, 개인회생채무자가 그 개시신청 전에 부인권 대상행위를 한 경우에도 법은 부인권 행사를 통하여 일탈된 재산을 회복시켜 이를 포함한 총재산의 청산가치 이상을 변제하도록 하는 절차를 마련해 두고 있는 점, 그 밖에 개인회생절차를 파산절차에 우선하도록 한 제도의 취지와 기능 등을 종합하면, 설령 채무자가 개인회생절차 개시신청 전에 특정 채권자에 대한 편파적인 변제나 담보제공 행위를 하여 다른 채권자들을 해하는 결과를 초래하였다고 하더라도, 다른 특별한 사정이 없는 한, 단지 그러한 사정만으로 개인회생절차에 의하는 것이 채권자 일반의 이익에 적합하지 않다고 단정할 수는 없다고 할 것이다.“고 하였습니다(대법원 2010. 11. 30. 자 2010마1179 결정 참조). 따라서 법원은 특별한 사정이 없는 한 특정채권자에 대한 편파변제를 이유로 귀하의 개인회생절차개시신청을 기각하기보다는 개시결정을 한 후 채무자인 귀하에게 부인권행사명령 또는 변제계획안 수정명령 등을 하게 될 것으로 보입니다.",사례질문답변
QA_0287,개인회생>개시결정및채권자이의등>개시(기각)결정및효력>Ⅱ.개시기각결정,회생절차개시신청이 기각되는 사유는 무엇인가요?,"법원은 1. 회생절차의 비용을 미리 납부하지 아니한 경우, 2. 회생절차개시신청이 성실하지 아니한 경우, 3. 그 밖에 회생절차에 의함이 채권자 일반의 이익에 적합하지 아니한 경우 회생절차개시의 신청을 기각하여야 합니다.",사례질문답변
QA_0288,개인회생>개시결정및채권자이의등>개시(기각)결정에대한불복방법>Ⅰ.개인회생절차개시결정에대한불복방법,개인회생절차 개시신청 기각결정에 대한 항고심에서 심문 종결시 또는 결정 고지시까지 제출된 사실과 자료를 토대로 항고이유의 당부를 판단하여야 하나요?,"대법원은 “채무자 회생 및 파산에 관한 법률(이하 ‘법’이라고 한다) 제33조에 의하면, 개인회생절차는 위 법에 특별한 규정이 없는 한 민사소송법의 규정을 준용하도록 하고 있고, 민사소송법 제443조 에 의해 항고법원의 소송절차에 준용되는 민사항소심이 속심제를 취하고 있는 이상, 개인회생절차 개시신청의 기각결정에 대한 항고심은 심문을 연 때에는 그 심문 종결시까지, 심문을 열지 아니한 때에는 결정의 고지시까지 제출된 사실과 자료를 토대로 제1심결정 혹은 항고이유의 당부를 판단하여야 한다.”고 판시하였습니다(대법원 2011. 4. 28. 자 2010마1980 결정). 따라서 개인회생절차 개시신청 기각결정에 대한 항고심에서 심문 종결시 또는 결정 고지시까지 제출된 사실과 자료를 토대로 항고이유의 당부를 판단하여야합니다.",사례질문답변
QA_0289,개인회생>개시결정및채권자이의등>개시(기각)결정에대한불복방법>Ⅰ.개인회생절차개시결정에대한불복방법,"개인회생절차 개시신청에 관한 재판에 대하여 즉시항고가 제기된 경우, 개인회생절차 개시요건을 충족하고 있는지에 관한 판단 기준 시점은 언제인가요?","대법원은 “개인회생절차개시의 요건을 충족하고 있는지 여부는 개시신청 당시를 기준으로 하여 판단하는 것이 원칙이나, 개시신청에 관한 재판에 대하여 즉시항고가 제기된 경우에는 항고심의 속심적 성격에 비추어 항고심 결정 시를 기준으로 판단하여야 한다.”고 판시하였습니다(대법원 2011. 6. 10. 자 2011마201 결정). 따라서 개인회생절차 개시요건을 충족하고 있는지에 관한 판단 기준 시점은 항고심 결정시라 할 것입니다.",사례질문답변
QA_0290,개인회생>개시결정및채권자이의등>개시(기각)결정에대한불복방법>Ⅰ.개인회생절차개시결정에대한불복방법,회생절차개시신청에 관한 재판에 불복하는 방법은 무엇인가요?,"회생절차개시의 신청에 관한 재판에 대하여는 즉시항고를 할 수 있으며, 이러한 즉시항고에는 집행정지의 효력이 없습니다.",사례질문답변
QA_0291,개인회생>개시결정및채권자이의등>개시(기각)결정에대한불복방법>Ⅱ.개인회생개시신청기각결정에대한불복방법,저는 얼마전 개인회생절차개시신청을 하였는데 법원에서 개시신청기각결정이 있었습니다. 이에 대해서 다투어 보고 싶은데 방법이 있을까요?,"개인회생절차개시신청에 관한 재판에 대하여는 즉시항고 할 수 있습니다(채무자 회생 및 파산에 관한 법률 제598조 제1항). 즉시항고를 할 수 있는 자는 그 재판에 이해관계를 가진 자(동법 제13조 제1항)로, 개인회생절차개시결정의 경우에는 개인회생채권자목록에 기재된 개인회생채권자와 담보권실행을 위한 경매의 중지·금지 효력을 받는 별제권자 등이 될 것이나, 개시신청기각결정의 경우에는 신청인인 채무자만이 이해관계를 가진다 할 것이므로 채무자만이 즉시항고를 할 수 있게 됩니다.즉시항고는 재판의 공고가 있는 때에는 그 공고가 있은 날로부터 14일 이내에 하여야 하고(동법 제13조 제2항), 공고는 관보게재일 또는 전자통신매체를 이용한 공고가 있은 날의 다음날에 그 효력이 발생하는바(동법 제9조 제2항), 개인회생절차개시결정을 할 경우에는 공고를 하여야 하므로(동법 제597조 제1항), 개시결정에 대한 즉시항고기간은 공고가 있은 날의 다음날로부터 기산하여 14일이 됩니다.반면, 개시신청기각결정의 경우에는 공고되지 아니하므로 민사소송법이 준용되어 즉시항고기간은 신청인에게 결정이 고지된 날로부터 1주일입니다(동법 제33조, 민사소송법 제444조 제1항).즉시항고기간을 넘긴 후 제출된 항고장에 대하여는 원심 재판장이 명령으로 항고장을 각하하여야 합니다(동법 제33조, 민사소송법 제443조, 제399조 제2항).개시신청 기각결정에 대한 즉시항고가 있는 경우에는 항고법원은 신청인의 신청에 의하거나, 직권으로 법 제592조에 의한 보전처분 및 법 제593조에 의한 중지·금지명령, 포괄적 금지명령을 발할 수 있습니다(동법 제598조 제2항). 본 규정은 즉시항고에 대한 재판이 있을 때까지 상당한 시간이 소요되므로, 그 사이에 개인회생재단에 속하는 재산이 채무자의 임의변제, 채권자들의 개별적 강제집행 등으로 산일되면 장래 기각결정이 번복되어 개인회생절차가 개시되어도 그 목적을 달성할 수 없게 될 가능성이 있음을 고려한 것입니다. 개인회생절차개시신청의 기각결정에 대한 즉시항고인이 중지명령의 실효로 속행되는 강제집행 등 절차를 저지하기 위하여는 즉시항고인이 개시신청 기각결정에 대하여 즉시항고를 하면서 항고법원에 다시 법 제593조의 중지명령을 신청하거나, 법원이 직권으로 중지명령을 발할 수도 있습니다(동법 제598조 제2항). 개시신청기각결정에 대한 채무자의 즉시항고가 있게 되면 항고법원은 즉시항고의 절차가 법률에 위반되거나 즉시항고가 이유 없다고 인정하는 때에는 결정으로 즉시항고를 각하 또는 기각하여야 하고, 즉시항고가 이유 있다고 인정하는 때에는 원래의 결정을 취소하고 사건을 원심법원에 환송하여야 합니다(동법 제598조 제4항, 제5항).항고법원의 결정에 대하여는 재판에 영향을 미친 헌법, 법률, 명령 또는 규칙의 위반이 있음을 이유로 하는 경우에 한하여 대법원에 재항고를 할 수 있습니다(동법 제33조, 민사소송법 제442조).따라서 귀하가 법원의 개시신청기각결정에 대해 다투어 보고 싶으시다면 채무자 회생 및 파산에 관한 법률 제598조 제1항에 따라 즉시항고를 해볼 수 있을 것입니다",사례질문답변
QA_0292,개인회생>개시결정및채권자이의등>개시(기각)결정에대한불복방법>Ⅱ.개인회생개시신청기각결정에대한불복방법,저는 자영업을 하면서 생긴 채무를 모두 다 변제할 수는 없어서 개인회생 신청을 하였습니다. 그런데 개인회생절차개시신청이 기각되었습니다. 다툴 수 있는 방법이 있나요?,"채무자 회생 및 파산에 관한 법률 제598조 제1항은 개인회생절차개시신청에 대한 재판에 대하여는 즉시항고 할 수 있다고 규정하고 있습니다.즉시항고는 재판의 공고가 있는 때에는 그 공고가 있은 날로부터 14일 이내에 하여야 하고(동법 제13조 제2항), 공고는 관보게재일 또는 전자통신매체를 이용한 공고가 있은 날의 다음날에 그 효력이 발생하므로(동법 제9조 제2항), 개인회생절차개시결정을 할 경우에는 공고를 해야 하고(동법 제597조 제1항), 개시결정에 대한 즉시항고기간은 공고가 있은 날의 다음날로부터 기산하여 14일이 됩니다. 반면 개시신청기각결정의 경우에는 공고되지 아니하므로 민사소송법이 준용되어 즉시항고기간은 신청인에게 결정이 고지된 날로부터 1주일입니다(동법 제33조, 민사소송법 제444조 제1항).개인회생절차개시신청 기각결정에 대한 즉시항고가 있는 경우 항고법원은 신청인의 신청에 의하거나 직권으로 보전처분 및 중지,금지명령, 포괄적 금지명령을 발할 수 있고(동법 제598조 제2항, 제592조, 제593조), 즉시항고의 절차가 법률에 위반되거나 즉시항고가 이유 없다고 인정하는 때에는 결정으로 즉시항고를 각하 또는 기각하여야 하며, 즉시항고가 이유 있다고 인정하는 때에는 원래의 결정을 취소하고 사건을 원심법원에 환송하여야 합니다(동법 제598조 제4항, 제5항).법원은 개인회생절차개시결정을 취소하는 결정이 확정된 때에는 즉시 그 주문을 공고하고, 채무자, 알고 있는 개인회생채권자, 개인회생절차가 개시된 채무자의 재산을 소지하고 있거나 그에게 채무를 부담하는 자에게 그 결정의 취지를 송달하여야 합니다(동법 제599조).따라서 개인회생개시신청 기각결정에 대해 다투어 보고 싶으시면 결정이 고지된 날로부터 1주일 내에 즉시항고를 할 수 있습니다.",사례질문답변
QA_0293,개인회생>개시결정및채권자이의등>채권자이의및채권자집회>Ⅱ.개인회생채권자집회,개인회생채권자집회에 출석하라고 하는데 다른 사람을 대신 보내도 되나요?,"채권자집회기일에 채무자 대신 대리인이 출석할 수 있는지에 관하여, 일반 재판절차와 마찬가지로 대리인이 출석하여 진행할 수 있다는 견해가 있습니다. 그러나 채무자는 개인회생채권자집회에 출석하여 개인회생채권자의 요구가 있는 경우 변제계획에 관하여 필요한 설명을 하여야 하고, 법원 빛 개인회생채권자에게 본인이 제출한 변제계획을 수행할 의지 및 수행능력이 있음을 보여야 한다는 점에서 본인이 직접 출석하여야 할 것입니다.",사례질문답변
QA_0294,개인회생>개인회생기타>개인회생기타,"甲은 개인회생절차 개시신청 전 약 1년 동안 발생시킨 대출금채무가 전체 개인회생채무 중 약 80%에 해당하는 경우, 개인회생절차가 개시되기 어렵나요?","대법원은 “甲이 개인회생절차 개시신청 전 약 1년 동안 발생시킨 대출금채무가 전체 개인회생채무 중 약 80%에 해당한 사안에서, 대출금 중 상당 부분이 기존 채무의 상환에 사용된 점 등에 비추어 개인회생절차 개시신청에 근접하여 발생한 채무액이 전체 채무액에서 차지하는 비중이 높다는 사정만으로 개인회생절차에 의함이 채권자 일반의 이익에 적합하지 않거나 채무자가 부정한 목적으로 개인회생절차 개시신청을 하였다고 단정하기 어렵다”고 판시하였습니다(대법원 2013. 3. 15.자 2013마101 결정). 따라서 개인회생절차 개시신청 약 1년동안 발생시킨 대출금채무가 전체 개인회생채무 중 약 80%에 해당한다는 사정만으로 개인회생절차가 개시될 수 없다고 판단할 수 없을 것입니다.",사례질문답변
