QA_ID,법률분류,질문,답변,출처유형
QA_0382,개인회생>개인회생기타>재단채권(우선변제채권)>Ⅰ.개인회생재단채권,"저는 개인사업자로 등록하여 가구공장을 운영하던 중 매출 부진과 거래업체 미수대금을 회수하지 못하여 공장을 그만두게 되었고 얼마 전 폐업신고를 하였습니다. 폐업 당시 다른 거래업체와 은행에 약 5,000만원 정도의 채무가 있었고 현재까지 근로자들의 임금 500만원 정도와 부가가치세 200만원 정도를 내지 못한 상태인데, 개인회생을 신청할 경우 위 임금과 세금에 대해서도 면제가 가능한가요?","귀하의 경우 근로자들의 임금채권에 대해서는 앞에서 설명한 바와 같이 개인회생절차에 의하지 않고 수시로 다른 개인회생채권보다 먼저(우선하여) 변제해야 하고 변제계획의 내용에는 개인회생재단채권 전액의 변제에 관한 사항을 필수적으로 기재하여야 합니다. 귀하의 근로자들에 대한 임금지급의무는 이미 변제기가 도래한 것으로 보여 임금채권자들이 별도로 변제기를 연장해 주거나 분할상환에 대하여 합의해 주지 않는다면 귀하는 위 임금 500만원을 일시에 변제해야 할 것으로 보이며, 만일 그렇지 못할 경우 임금채권자들이 귀하의 급여채권에 강제집행을 하는 등으로 인하여 변제계획 수행이 불가능하게 되어 개인회생절차가 폐지될 우려가 있으므로 우선 임금채권자들의 협조를 얻어야 개인회생을 수월히 진행할 수 있으며, 임금채권은 비면책채권이므로 개인회생제도를 통하여 임금채권의 변제의무를 면할 수는 없습니다.또한 부가가치세의 경우 이미 납부기한이 도래한 국세이므로 이는 일반의 우선권 있는 개인회생채권으로 취급되어 그 전액의 변제에 관한 사항을 변제계획에 기재해야 하고 앞의 설명과 같은 변제예정액표를 작성해야 합니다. 다만, 실무에 있어서는 일반의 개인회생채권자의 이익을 위하여 일반의 우선권 있는 개인회생채권의 변제를 1년 이상 허용하지 않는 경향이 있고(법에는 최저변제액 이상을 변제하는 경우라면 일반의 우선권 있는 개인회생채권의 변제기간을 제한하고 있지 않음), 그에 따라 개인회생위원이 일반의 우선권 있는 개인회생채권을 일부 변제하고 변제계획안을 다시 작성하라고 권고하는 경우가 많으니 참고하시기 바랍니다.",사례질문답변
QA_0383,개인회생>개인회생기타>재단채권(우선변제채권)>Ⅱ.우선권있는개인회생채권,"우선권 있는 개인회생채권에는 어떤 것들이 있으며, 그에 대한 법적 취급은 어떠한지 궁금합니다.","국세징수법 또는 국세징수의 예에 의하여 징수할 수 있는 청구권(국세, 지방세 등 지방자치단체의 징수금, 관세 및 가산금, 건강보험료, 산업재해보상보험료 등), 즉 조세 등의 청구권(이하 조세채권이라 합니다)은 징수권자가 국세징수법 또는 국세징수의 예에 의한 체납처분으로 채무자의 재산을 압류한 후 그 압류한 재산의 환가대금에서 우선변제 받을 수 있다는 점에서 일반적으로 우월성이 인정되고 있으므로 일반의 우선권 있는 개인회생채권입니다. 다만 개인회생절차개시결정 전에 조세채권이 성립하였을 것을 필요로 합니다.우선변제권이 있는 임차보증금 반환채권이 개인회생절차상 우선권 있는 채권에 해당한다고 보는 견해가 있을 수도 있습니다. 이러한 견해는 채무자 회생 및 파산에 관한 법률 제586조, 제415조 제1항의 규정, 즉 주택임대차보호법 제3조 제1항의 규정에 의한 대항요건(주택의 인도와 주민등록)을 갖추고 임대차계약증서상의 확정일자를 받은 임차인은 개인회생재단에 속하는 주택(그 대지를 포함합니다)의 환가대금에서 후순위권리자 그 밖에 채권자보다 우선하여 보증금을 변제받을 권리가 있다는 규정 등을 근거로 합니다. 위 대항요건과 확정일자를 갖춘 임차인 외에, 주택임대차보호법 제8조(소액보증금 중 일정액의 보호)의 규정에 의한 임차인은 같은 조의 규정에 의한 보증금을 개인회생재단에 속하는 주택(그 대지를 포함합니다)의 환가대금에서 다른 담보물권자보다 우선하여 변제받을 권리가 인정되므로 이러한 소액임차인도 개인회생절차상의 우선권 있는 채권인지 여부가 문제 될 수 있습니다. 그러나 임차보증금 반환채권은 다른 일반의 개인회생채권보다 우월적 지위를 가지기는 하지만, 임차목적물의 환가액의 한도 내에서만 우선권을 가지는 것에 불과하여 별제권부 채권과 유사한 성격을 가지는 것으로 봄이 상당하기 때문에 우선권 있는 개인회생채권으로 취급되기 보다는 별제권에 준하여 취급되어야 할 것입니다. 그리고 주택임대차보호법에 관한 위 규정들은 상가건물임대차보호법에 기하여 대항요건을 갖추고 확정일자를 받은 임차인과 같은 법의 소액보증금보호 규정에서 정해진 임차인에게도 준용되는데(채무자 회생 및 파산에 관한 법률 제586조, 제415조 제3항), 그 임차보증금 반환채권도 동일하게 취급되어야 할 것입니다.법에 따라서는 환경개선부담금, 식품위생법상 과징금, 국유재산대부료 등과 같이 국세 또는 지방세 체납처분의 예에 따라 징수할 수 있다고 규정한 것들이 있습니다. 그러나 이러한 규정들은 “국제 및 지방세를 제외한 기타의 채권에 우선하여 징수한다.”와 같은 징수순위에 관한 규정이 아니라 체납처분의 절차에 따라 징수할 수 있다는 자력집행권이 있음을 규정한 것에 불과하다고 보아야 하며, 위 채권들에 관하여 일반 채권에 비해 상대적으로 징수의 우선순위를 정하고 있는 규정도 없기 때문에 위 채권들을 일반의 우선권 있는 채권으로 보기는 어렵습니다. 원칙적으로 각 채권의 성격에 따라 구분하여 과태료와 같이 행정법상 의무 위반이나 불이행에 대한 제재로서의 성격을 가진 것은 동법 제581조 제2항, 제446조 제1항 제4호를 유추적용하여 후순위 개인회생채권으로 하고 그렇지 않은 것은 일반 개인회생채권으로 봄이 상당하다 할 것입니다.우선권 있는 개인회생채권도 개인회생채권의 일종이므로 개인회생절차개시결정으로 인하여 강제집행이 중지 또는 금지되고(동법 제600조 제1항), 원칙적으로 변제계획에 의하여서만 변제가 허용됩니다(동법 제581조 제1항, 제582조). 국세징수법 또는 국세징수의 예에 의한 체납처분도 그 예외는 아닙니다(동법 제600조 제1항 제4호).한편 채무자 회생 및 파산에 관한 법률은 우선권 있는 개인회생채권에 대하여 특별한 취급을 하고 있는바, 구체적으로 변제계획에는 우선권 있는 개인회생채권의 전액에 변제에 관한 사항을 정하여야 하고(동법 제611조 제1항 제2호), 일정한 기간 안의 채권액에 관하여 우선권 있는 경우 그 기간은 개인회생절차개시결정시부터 소급하여 계산하도록 하고 있습니다(동법 제581조 제2항, 제442조).",사례질문답변
QA_0384,개인회생>개인회생기타>재단채권(우선변제채권)>Ⅱ.우선권있는개인회생채권,"저는 사업실패로 인해 밀린 세금과 건강보험료, 그리고 대부회사로 양도된 대출금 채무 및 차량을 운행하면서 오랫동안 쌓인 속도위반 과태료와 주정차위반 과태료, 자동차검사를 받지 않아 부과된 과태료가 있습니다. 이 모든 채무를 개인회생을 통해 변제할 수 있나요?","개인회생채권은 우선권 있는 개인회생채권, 일반 개인회생채권, 후순위 개인회생채권이 있는데, 우선권 있는 개인회생채권은 변제계획에 전액의 변제에 관한 사항을 정하여야 하므로(채무자 회생 및 파산에 관한 법률 제611조 제1항 제2호), 일반 개인회생채권에 우선하여 전액 변제해야 합니다.우선권 있는 개인회생채권에 해당하는 것으로 국세징수법이나 지방세징수법 또는 국세징수의 예에 의하여 징수할 수 있는 청구권(국세, 지방세 등 지방자치단체의 징수금, 관세 및 가산금, 건강보험료 등)으로서 그 징수우선순위가 일반 개인회생채권보다 우선하는 것을 들 수 있는데, 다만 개인회생절차개시결정 전에 조세채권이 성립하였을 것을 필요로 합니다(동법 제473조 제2호). 임대차보증금반환채권에 대해서는 이를 우선채권으로 취급하기 보다는 별제권에 준하여 취급을 합니다.후순위 개인회생채권은 우선권 있는 개인회생채권과 일반 개인회생채권이 모두 변제되고 난 후에 변제계획상 변제될 수 있는데, 대표적으로 파산선고 후의 이자, 파산선고 후의 불이행으로 인한 손해배상액 및 위약금, 파산절차참가비용, 벌금ㆍ과료ㆍ형사소송비용ㆍ추징금 및 과태료 등이 있습니다(동법 제581조 제2항, 제446조 제1항).그리고 위 각 채권을 제외한 나머지 개인회생채권을 일반 개인회생채권이라고 합니다.따라서 세금과 건강보험료는 우선권 있는 개인회생채권으로 전액 우선변제 되어야 하고, 그 다음에 일반 개인회생채권인 대출금이 모두 변제될 수 있어야 비로소 후순위채권인 과태료가 변제될 수 있으며, 그렇지 못한 경우에는 과태료는 개인회생채권에서 제외됩니다.",사례질문답변
QA_0385,개인회생>개인회생절차의면책>면책결정및효력>Ⅰ.개인회생채권의면책신청,"甲은 개인회생신청을 하였으나, 심문기일과 면책신청서를 통해 개인택시 운송면허를 보유하고 있음에도 보유 재산이 전혀 없다고 진술하였습니다. 이 경우, 면책불허가 사유에 해당하나요?","대법원은 “채무자가 파산절차의 심문기일과 면책신청서를 통해 개인택시 운송면허를 보유하고 있음에도 보유 재산이 전혀 없다고 진술한 부분이 채무자 회생 및 파산에 관한 법률 제564조 제1항 제3호의 ‘채무자가 법원에 대하여 그 재산상태에 관하여 허위의 진술을 한 때’에 해당하는지가 문제된 사안에서, 채권자가 운송면허의 매각을 통해 채권을 변제받고자 한다고 명백히 밝히고 있는 상황에서 채무자가 개인택시의 운행사실을 인정하면서 재산이 하나도 없다고 진술한 취지는 개인택시 운송면허 외에 다른 재산은 없다는 취지로 진술한 것이라고 하여, 파산절차에서 ‘고의로’ 재산상태에 관하여 허위 진술을 하였다고 보기 어렵다.”고 판시하였습니다(대법원 2011. 3. 18.자 2011마122 결정). 따라서 과실로 허위 진술을 한 경우 면책불허가 사유가 될 수는 없을 것입니다.",사례질문답변
QA_0386,개인회생>개인회생절차의면책>면책결정및효력>Ⅰ.개인회생채권의면책신청,개인회생 신청을 한 甲이 어느 채권자에게 변제기에 도달한 채무를 변제하는 경우 회생불허가 사유에 해당하나요? ,"대법원은 “채무자 회생 및 파산에 관한 법률 제564조 제1항 제1호, 제651조 제1항 제2호는 ‘파산의 원인인 사실이 있음을 알면서 어느 채권자에게 특별한 이익을 줄 목적으로 한 담보의 제공이나 채무의 소멸에 관한 행위로서 채무자의 의무에 속하지 아니하거나 그 방법 또는 시기가 채무자의 의무에 속하지 아니하는 행위가 있다고 인정하는 때’를 면책불허가사유로 규정하고 있으므로, 채무자가 파산의 원인인 사실이 있음을 알면서 여러 채권자들 중에서 어느 채권자에게 특별한 이익을 줄 목적으로 변제하였더라도 그 행위가 ‘변제기에 도달한 채무를 그 내용에 좇아 변제하는 것’인 경우에는 위 면책불허가사유에 해당한다고 볼 수 없다.”고 판시하였습니다(대법원 2016. 8. 31.자 2016마899 결정). 따라서 변제기에 도달한 채무를 변제하는 행위가 회생불허가 사유에 해당한다고 볼 수는 없을 것입니다.",사례질문답변
QA_0387,개인회생>개인회생절차의면책>면책결정및효력>Ⅰ.개인회생채권의면책신청,개인회생 절차에서 면책결정은 어떻게 받을 수 있나요?,"면책결정은 원칙적으로 채무자가 변제계획에 따른 변제를 완료한 때에 하게 됩니다. 이때 채무자는 면책을 신청할 수 있고 법원이 직권으로 면책결정을 할 수도 있습니다(채무자 회생 및 파산에 관한 법률 제624조 제1항). 법원은 채무자가 변제계획에 기한 변제를 완료하였음을 소명하는 서류를 제출하거나 기타 채무자가 제출하는 서류로 면책요건을 충족하였다고 판단되는 경우 면책결정을 내릴 수 있습니다.그러나 면책결정 당시 채무자가 악의로 개인회생채권자목록에 기재하지 아니한 개인회생채권이 있는 경우, 채무자가 이 법에서 정한 채무자의 의무를 이행하지 아니한 경우 법원은 면책신청에 관하여 면책을 불허하는 결정을 할 수 있습니다.한편 채무자가 변제계획에 따른 변제를 완료하지 못하게 된 경우에도 ① 채무자가 책임질 수 없는 사유로 인하여 변제를 완료하지 못하였을 것 ② 개인회생채권자가 면책결정일까지 변제 받은 금액이 채무자가 파산절차를 신청한 경우 파산절차에서 배당 받을 금액보다 적지 아니할 것 ③ 변제계획의 변경이 불가능할 것의 요건을 모두 갖춘 경우 법원은 이해관계인의 의견을 들은 후 면책의 결정을 할 수 있습니다.",사례질문답변
QA_0388,개인회생>개인회생절차의면책>면책결정및효력>Ⅱ.개인회생면책결정의효력,"개인회생신청을 하고 변제계획인가결정을 받아 변제계획대로 성실하게 변제를 모두 마치고 법원으로부터 면책결정을 받는 경우, 부담하고 있는 채무들은 어떻게 처리되는 것인가요?","법원은 채무자가 변제계획에 따른 변제를 완료한 때에는 당사자의 신청에 의하거나 직권으로 면책의 결정을 하여야 합니다(채무자 회생 및 파산에 관한 법률 제624조 제1항).면책이란 채무에 관하여 ‘책임이 면제된다’는 것을 의미하는데(동법 제625조 제2항), ‘책임의 면제’는 ‘채무의 소멸’과는 엄연히 다릅니다. 채무가 소멸된다는 것은 그 채무가 없어지게 된다는 의미인 반면, 책임이 면제된다는 것은 채무가 없어지는 것은 아니나 채권자가 당해 채무를 더 이상 이행할 것을 요구할 수 없게 되는 것을 의미합니다. 다시 말해 채무의 이행을 청구하는 소를 제기하거나, 채무의 이행을 확보하기 위한 수단으로 채무자의 재산에 가압류 등을 하는 것 또는 채무를 강제로 실현하기 위하여 채무자의 재산에 강제집행을 하는 것 등이 불가능하게 되나 채무 그 자체가 없어지는 것은 아닙니다. 이를 자연채무라고 하는데, 채무자가 자연채무를 임의로 이행하게 될 경우 이는 유효한 변제로 되어 부당이득반환을 청구할 수 없게 됩니다. 이는 상계의 자동채권으로 할 수도 있고, 경개 또는 준소비대차의 기초로 삼을 수 있으며, 그에 대한 보증이나 담보도 유효한 것으로 보게 됩니다.또 면책의 결정은 확정된 후가 아니면 그 효력이 발생하지 않습니다(동법 제625조 제1항). 면책결정에 대해 항고가 제기되지 않고 항고기간이 도과하거나, 항고가 제기되었더라도 그 항고가 기각되는 때에는 면책결정이 확정되게 됩니다.이밖에도 면책은 개인회생채권자가 채무자의 보증인 그 밖에 채무자와 더불어 채무를 부담하는 자에 대하여 가지는 권리와 개인회생채권자를 위하여 제공한 담보에 영향을 미치지 않습니다(동법 제625조 제3항). 따라서 채권자는 채무자에 대한 면책결정에도 불구하고 보증인이나 연대채무자에 대하여 그 채무의 이행을 요구할 수 있고, 제3자가 제공한 담보물이 있을 경우에는 그 물건에 대한 담보권을 행사할 수도 있습니다.최종적으로 면책결정이 확정되면 개인회생절차는 종료됩니다(채무자 회생 및 파산에 관한 규칙 제96조).이에 따라 귀하에 대한 개인회생절차는 법원의 면책결정으로 인하여 종료되었으며, 개인회생채무는 면책제외채권(채무자 회생 및 파산에 관한 법률 제625조 제2항)에 해당한다거나 면책취소사유가 있다는 등의 사정이 없는 한 자연채무로 되어 귀하는 이를 이행할 법적인 의무를 부담하지 아니할 것으로 보입니다.",사례질문답변
QA_0389,개인회생>개인회생절차의면책>면책결정및효력>Ⅱ.개인회생면책결정의효력,저는 50대 남성으로 개인회생신청을 하고 변제계획인가결정을 받아 변제계획대로 성실하게 변제를 모두 마치고 법원으로부터 면책결정을 받았습니다. 면책결정을 받게 되면 제가 부담하고 있는 채무들은 어떻게 처리되는 것인지 알고 싶습니다.,"법원은 채무자가 변제계획에 따른 변제를 완료한 때에는 당사자의 신청에 의하거나 직권으로 면책의 결정을 하여야 합니다(채무자 회생 및 파산에 관한 법률 제624조 제1항).면책이란 채무에 관하여 ‘책임이 면제된다’는 것을 의미하는데(동법 제625조 제2항), ‘책임의 면제’는 ‘채무의 소멸’과는 엄연히 다릅니다. 채무가 소멸된다는 것은 그 채무가 없어지게 된다는 의미인 반면, 책임이 면제된다는 것은 채무가 없어지는 것은 아니나 채권자가 당해 채무를 더 이상 이행할 것을 요구할 수 없게 되는 것을 의미합니다. 다시 말해 채무의 이행을 청구하는 소를 제기하거나, 채무의 이행을 확보하기 위한 수단으로 채무자의 재산에 가압류 등을 하는 것 또는 채무를 강제로 실현하기 위하여 채무자의 재산에 강제집행을 하는 것 등이 불가능하게 되나 채무 그 자체가 없어지는 것은 아닙니다. 이를 자연채무라고 하는데, 채무자가 자연채무를 임의로 이행하게 될 경우 이는 유효한 변제로 되어 부당이득반환을 청구할 수 없게 됩니다. 이는 상계의 자동채권으로 할 수도 있고, 경개 또는 준소비대차의 기초로 삼을 수 있으며, 그에 대한 보증이나 담보도 유효한 것으로 보게 됩니다. 또 면책의 결정은 확정된 후가 아니면 그 효력이 발생하지 않습니다(동법 제625조 제1항). 면책결정에 대해 항고가 제기되지 않고 항고기간이 도과하거나, 항고가 제기되었더라도 그 항고가 기각되는 때에는 면책결정이 확정되게 됩니다.이밖에도 면책은 개인회생채권자가 채무자의 보증인 그 밖에 채무자와 더불어 채무를 부담하는 자에 대하여 가지는 권리와 개인회생채권자를 위하여 제공한 담보에 영향을 미치지 않습니다(동법 제625조 제3항). 따라서 채권자는 채무자에 대한 면책결정에도 불구하고 보증인이나 연대채무자에 대하여 그 채무의 이행을 요구할 수 있고, 제3자가 제공한 담보물이 있을 경우에는 그 물건에 대한 담보권을 행사할 수도 있습니다.최종적으로 면책결정이 확정되면 개인회생절차는 종료됩니다(채무자 회생 및 파산에 관한 규칙 제96조). 이에 따라 귀하에 대한 개인회생절차는 법원의 면책결정으로 인하여 종료되었으며, 개인회생채무는 면책제외채권(채무자 회생 및 파산에 관한 법률 제625조 제2항)에 해당한다거나 면책취소사유가 있다는 등의 사정이 없는 한 자연채무로 되어 귀하는 이를 이행할 법적인 의무를 부담하지 아니할 것으로 보입니다.",사례질문답변
QA_0390,개인회생>개인회생절차의면책>면책결정및효력>Ⅱ.개인회생면책결정의효력,저는 개인회생신청을 하고 변제계획인가결정을 받아 변제계획대로 성실하게 변제를 모두 마치고 법원으로부터 면책결정을 받았습니다. 그럼에도 개인회생채권자 중 일부가 계속하여 추심행위를 하고 있습니다. 어떻게 대응해야 할까요?,"면책을 받은 개인인 채무자에 대하여 면책된 사실을 알면서 면책된 채권에 기하여 강제집행·가압류 또는 가처분의 방법으로 추심행위를 하는 것은 금지되어 있습니다. 이를 위반할 경우 500만 원 이하의 과태료에 처하게 됩니다(채무자회생 및 파산에 관한 법률 제660조 제3항). 간혹 채권자가 면책 확정 전에 받은 집행권원(판결, 지급명령, 조정조서, 공정증서 등)을 근거로 강제집행을 하는 경우가 있습니다. 이러한 경우 면책이 확정된 사실은 청구이의의 사유가 되므로 채무자는 청구이의의 소를 제기하여(민사집행법 제44조) 승소판결을 받아 강제집행을 취소할 수 있습니다. 한편, 청구이의의 소의 선고시까지는 상당한 기간이 소요되므로 급박한 경우에는 청구이의의 소를 제기하면서 잠정처분으로서 강제집행정지신청을 하여 법원의 결정이 나면 강제집행을 정지시켜 놓을 수도 있습니다. 또한 별도의 집행권원을 가지고 있지 않은 채권자가 면책확정이 되었음에도 변제를 요구하는 경우에는 면책확인의 소를 제기하여 면책이 되었음을 확인 받을 수도 있습니다.",사례질문답변
QA_0391,개인회생>개인회생절차의면책>면책결정및효력>Ⅱ.개인회생면책결정의효력,저는 개인회생신청을 하고 변제계획인가결정을 받아 변제계획대로 성실하게 변제를 모두 마치고 법원으로부터 면책결정을 받았습니다. 면책결정을 받게 되면 제가 부담하고 있는 채무들은 어떻게 처리되는 것인지 알고 싶습니다.,"면책을 받은 채무자는 변제계획에 따라 변제한 것을 제외하고 개인회생채권자에 대한 채무에 관하여 그 책임이 면제됩니다(채무자 회생 및 파산에 관한 법률 제625조 제2항). ‘책임의 면제’는 ‘채무의 소멸’과 다릅니다. 채무가 소멸된다는 것은 그 채무가 없어지게 된다는 의미인 반면, 책임이 면제된다는 것은 채무가 없어지는 것은 아니나 채권자가 당해 채무를 더 이상 이행할 것을 요구할 수 없게 되는 것을 의미합니다. 다시 말해 채무의 이행을 청구하는 소를 제기하거나, 채무의 이행을 확보하기 위한 수단으로 채무자의 재산에 가압류 등을 하는 것 또는 채무를 강제로 실현하기 위하여 채무자의 재산에 강제집행을 하는 것 등이 불가능하게 되나 채무 그 자체가 없어지는 것은 아닙니다. 이를 자연채무라고 하는데, 채무자가 자연채무를 임의로 이행하게 될 경우 이는 유효한 변제로 되어 부당이득반환을 청구할 수 없게 됩니다. 이는 상계의 자동채권으로 할 수도 있고, 경개 또는 준소비대차의 기초로 삼을 수 있으며, 그에 대한 보증이나 담보도 유효한 것으로 보게 됩니다. 이밖에도 면책은 개인회생채권자가 채무자의 보증인 그 밖에 채무자와 더불어 채무를 부담하는 자에 대하여 가지는 권리와 개인회생채권자를 위하여 제공한 담보에 영향을 미치지 않습니다(동법 제625조 제3항). 따라서 채권자는 채무자에 대한 면책결정에도 불구하고 보증인이나 연대채무자에 대하여 그 채무의 이행을 요구할 수 있고, 제3자가 제공한 담보물이 있을 경우에는 그 물건에 대한 담보권을 행사할 수도 있습니다.결론적으로, 귀하의 개인회생채무는 면책제외채권(채무자 회생 및 파산에 관한 법률 제625조 제2항)에 해당한다거나 면책취소사유가 있다는 등의 사정이 없는 한 자연채무로 되어 귀하는 이를 이행할 법적인 의무를 부담하지 아니합니다.",사례질문답변
